{
  "agent_result": "success",
  "agent_subtype": "success",
  "apply_status": "ok",
  "area_depth": 2,
  "base_sha": "c979c4ec9304a4f358fbdc508a62f5dd73f72b18",
  "classes": [
    "guarded:tests:modify"
  ],
  "completed_at": "2026-10-04T04:26:16Z",
  "config_sha256": "9fc18789a36cd35dc1a776460c34111991cd7217132443543ad5001cc37646f2",
  "detector_version": "9c89829c1520af69bb4edcfd42675d986ca0a0cc666e3e931fe3c7fc46ae7c49",
  "evidence": {
    "failing_tests": [],
    "files": [
      {
        "area": "src/envguard",
        "op": "M",
        "path": "src/envguard/io/reader.py",
        "source": true,
        "test": false
      },
      {
        "area": "tests",
        "op": "M",
        "path": "tests/test_cli.py",
        "source": false,
        "test": true
      },
      {
        "area": "tests",
        "op": "M",
        "path": "tests/test_io.py",
        "source": false,
        "test": true
      }
    ],
    "guarded": [
      {
        "op": "modify",
        "path": "tests/test_cli.py",
        "root": "tests"
      },
      {
        "op": "modify",
        "path": "tests/test_io.py",
        "root": "tests"
      }
    ],
    "import_edges": [],
    "rule_hits": []
  },
  "gate_step": "none",
  "issue": 1,
  "lessons_cited": [],
  "patch_bytes": 2157,
  "patch_sha256": "8745155afa011a0414a337c4cedf8c9130dcb392bee41bbb6dd859073a5e9092",
  "pr": 10,
  "published": true,
  "published_sha": "a97541a7643e159869844a13a7c535470c3b89b7",
  "repo": "nik190799/envguard",
  "ruleset_sha256": "3978e9a5666975866a61ca892314dba9193073c37180a1cd81ccfb1a55c24e21",
  "run_attempt": 1,
  "run_id": "37176875037",
  "schema": "cadence.observation/1",
  "truncated": false,
  "verify_result": "success"
}
