{
  "agent_result": "success",
  "agent_subtype": "success",
  "apply_status": "ok",
  "area_depth": 2,
  "base_sha": "f97cd3e9deff5c019fd375ea09007a31892254e9",
  "classes": [
    "gate:test",
    "guarded:tests:modify",
    "test:tests/test_checks.py"
  ],
  "completed_at": "2026-10-04T04:49:37Z",
  "config_sha256": "9fc18789a36cd35dc1a776460c34111991cd7217132443543ad5001cc37646f2",
  "detector_version": "9c89829c1520af69bb4edcfd42675d986ca0a0cc666e3e931fe3c7fc46ae7c49",
  "evidence": {
    "failing_tests": [
      {
        "path": "tests/test_checks.py"
      }
    ],
    "files": [
      {
        "area": ".",
        "op": "M",
        "path": "CHANGELOG.md",
        "source": false,
        "test": false
      },
      {
        "area": ".",
        "op": "M",
        "path": "README.md",
        "source": false,
        "test": false
      },
      {
        "area": "src/envguard",
        "op": "M",
        "path": "src/envguard/cli/main.py",
        "source": true,
        "test": false
      },
      {
        "area": "src/envguard",
        "op": "M",
        "path": "src/envguard/cli/output.py",
        "source": true,
        "test": false
      },
      {
        "area": "src/envguard",
        "op": "M",
        "path": "src/envguard/core/checks.py",
        "source": true,
        "test": false
      },
      {
        "area": "tests",
        "op": "M",
        "path": "tests/test_checks.py",
        "source": false,
        "test": true
      },
      {
        "area": "tests",
        "op": "M",
        "path": "tests/test_cli.py",
        "source": false,
        "test": true
      }
    ],
    "guarded": [
      {
        "op": "modify",
        "path": "tests/test_checks.py",
        "root": "tests"
      },
      {
        "op": "modify",
        "path": "tests/test_cli.py",
        "root": "tests"
      }
    ],
    "import_edges": [],
    "rule_hits": []
  },
  "gate_step": "test",
  "issue": 3,
  "lessons_cited": [],
  "patch_bytes": 7670,
  "patch_sha256": "ac36d680239a27b010154d9377bd2cf20ca568ea4c9ce1beb5c33430ca6fcdb7",
  "pr": null,
  "published": false,
  "published_sha": null,
  "repo": "nik190799/envguard",
  "ruleset_sha256": "3978e9a5666975866a61ca892314dba9193073c37180a1cd81ccfb1a55c24e21",
  "run_attempt": 1,
  "run_id": "37177924341",
  "schema": "cadence.observation/1",
  "truncated": false,
  "verify_result": "failure"
}
